{
  "caseVersion": "1",
  "id": "unsupported-path-payment",
  "title": "Unsupported: path payment",
  "description": "The withdrawal was funded with a path payment (strict send, XLM to XLM). v1 does not interpret path payments, so this is unsupported, not matched.",
  "synthetic": true,
  "evidenceNote": "Recorded Horizon testnet responses for transaction bea39147fb218d958d1fea34b40e4f6a38ef855672af648d7f6b3e17d64029a7 (see fixtures/testnet/manifest.json). The SEP-24 record is SYNTHETIC: no real anchor produced it.",
  "intendedOutcome": "unsupported",
  "records": [
    {
      "id": "syn-wd-001",
      "kind": "withdrawal",
      "status": "completed",
      "started_at": "2026-10-07T13:55:00Z",
      "updated_at": "2026-10-07T14:30:00Z",
      "completed_at": "2026-10-07T14:30:00Z",
      "amount_in": "5.0000000",
      "amount_in_asset": "stellar:native",
      "amount_out": "4.0000000",
      "fee_details": {
        "total": "1.0000000",
        "asset": "stellar:native"
      },
      "withdraw_anchor_account": "GBC4Y6VLSLAMPSRSHPRF4WQ7UVUYCG3RYUZMDZX6UUE6AHBVNCVIJ7VI",
      "withdraw_memo": "1006",
      "withdraw_memo_type": "id",
      "from": "GCWEQIIHHZN2BS5Y7VPXMTMNHFL7Y5GEWJFG4QKPGRUIOP76JBVUXFWH",
      "stellar_transaction_id": "bea39147fb218d958d1fea34b40e4f6a38ef855672af648d7f6b3e17d64029a7"
    }
  ],
  "evidence": {
    "evidenceVersion": "1",
    "capture": {
      "network": "testnet",
      "horizon": "https://horizon-testnet.stellar.org",
      "capturedAt": "2026-10-07T14:02:48.196Z",
      "note": "Raw Horizon responses recorded by scripts/testnet-fixtures.mjs; XDR blobs, signatures and _links trimmed for size."
    },
    "items": [
      {
        "transaction": {
          "hash": "bea39147fb218d958d1fea34b40e4f6a38ef855672af648d7f6b3e17d64029a7",
          "successful": true,
          "ledger": 5071636,
          "created_at": "2026-10-07T14:02:47Z",
          "source_account": "GCWEQIIHHZN2BS5Y7VPXMTMNHFL7Y5GEWJFG4QKPGRUIOP76JBVUXFWH",
          "memo_type": "id",
          "memo": "1006",
          "fee_charged": "100",
          "operation_count": 1,
          "id": "bea39147fb218d958d1fea34b40e4f6a38ef855672af648d7f6b3e17d64029a7",
          "fee_account": "GCWEQIIHHZN2BS5Y7VPXMTMNHFL7Y5GEWJFG4QKPGRUIOP76JBVUXFWH",
          "max_fee": "100"
        },
        "operations": {
          "_embedded": {
            "records": [
              {
                "id": "21782510757220353",
                "type": "path_payment_strict_send",
                "transaction_hash": "bea39147fb218d958d1fea34b40e4f6a38ef855672af648d7f6b3e17d64029a7",
                "transaction_successful": true,
                "source_account": "GCWEQIIHHZN2BS5Y7VPXMTMNHFL7Y5GEWJFG4QKPGRUIOP76JBVUXFWH",
                "type_i": 13,
                "created_at": "2026-10-07T14:02:47Z",
                "asset_type": "native",
                "from": "GCWEQIIHHZN2BS5Y7VPXMTMNHFL7Y5GEWJFG4QKPGRUIOP76JBVUXFWH",
                "to": "GBC4Y6VLSLAMPSRSHPRF4WQ7UVUYCG3RYUZMDZX6UUE6AHBVNCVIJ7VI",
                "amount": "5.0000000",
                "path": [],
                "source_amount": "5.0000000",
                "destination_min": "5.0000000",
                "source_asset_type": "native"
              }
            ]
          }
        }
      }
    ]
  },
  "options": {}
}
