{
  "caseVersion": "1",
  "id": "pending-external-chain-confirmed",
  "title": "Pending: chain confirmed, payout not",
  "description": "Status is pending_external. The Stellar payment matches, but the transaction is not complete and the external payout is not observable. Confirmation on chain is not a bank payout.",
  "synthetic": true,
  "evidenceNote": "Recorded Horizon testnet responses for transaction 70e181ec6b886344c1853d078aeb7a36d1ba25431fffa058ef00fe68a1400efd (see fixtures/testnet/manifest.json). The SEP-24 record is SYNTHETIC: no real anchor produced it.",
  "intendedOutcome": "pending",
  "records": [
    {
      "id": "syn-wd-001",
      "kind": "withdrawal",
      "status": "pending_external",
      "started_at": "2026-10-07T13:55:00Z",
      "updated_at": "2026-10-07T14:05:00Z",
      "amount_in": "100.0000000",
      "amount_in_asset": "stellar:TRACEUSD:GC7Q2WPYYUISJ2FL26UVAEDSYJG2OBIFIGZSW2NYQCMOUKPM4LI3JRJD",
      "amount_out": "98.0000000",
      "fee_details": {
        "total": "2.0000000",
        "asset": "stellar:TRACEUSD:GC7Q2WPYYUISJ2FL26UVAEDSYJG2OBIFIGZSW2NYQCMOUKPM4LI3JRJD"
      },
      "withdraw_anchor_account": "GBC4Y6VLSLAMPSRSHPRF4WQ7UVUYCG3RYUZMDZX6UUE6AHBVNCVIJ7VI",
      "withdraw_memo": "1001",
      "withdraw_memo_type": "id",
      "from": "GCWEQIIHHZN2BS5Y7VPXMTMNHFL7Y5GEWJFG4QKPGRUIOP76JBVUXFWH",
      "stellar_transaction_id": "70e181ec6b886344c1853d078aeb7a36d1ba25431fffa058ef00fe68a1400efd"
    }
  ],
  "evidence": {
    "evidenceVersion": "1",
    "capture": {
      "network": "testnet",
      "horizon": "https://horizon-testnet.stellar.org",
      "capturedAt": "2026-10-07T14:00:43.205Z",
      "note": "Raw Horizon responses recorded by scripts/testnet-fixtures.mjs; XDR blobs, signatures and _links trimmed for size."
    },
    "items": [
      {
        "transaction": {
          "hash": "70e181ec6b886344c1853d078aeb7a36d1ba25431fffa058ef00fe68a1400efd",
          "successful": true,
          "ledger": 5071611,
          "created_at": "2026-10-07T14:00:42Z",
          "source_account": "GCWEQIIHHZN2BS5Y7VPXMTMNHFL7Y5GEWJFG4QKPGRUIOP76JBVUXFWH",
          "memo_type": "id",
          "memo": "1001",
          "fee_charged": "100",
          "operation_count": 1,
          "id": "70e181ec6b886344c1853d078aeb7a36d1ba25431fffa058ef00fe68a1400efd",
          "fee_account": "GCWEQIIHHZN2BS5Y7VPXMTMNHFL7Y5GEWJFG4QKPGRUIOP76JBVUXFWH",
          "max_fee": "100"
        },
        "operations": {
          "_embedded": {
            "records": [
              {
                "id": "21782403383037953",
                "type": "payment",
                "transaction_hash": "70e181ec6b886344c1853d078aeb7a36d1ba25431fffa058ef00fe68a1400efd",
                "transaction_successful": true,
                "source_account": "GCWEQIIHHZN2BS5Y7VPXMTMNHFL7Y5GEWJFG4QKPGRUIOP76JBVUXFWH",
                "type_i": 1,
                "created_at": "2026-10-07T14:00:42Z",
                "asset_type": "credit_alphanum12",
                "asset_code": "TRACEUSD",
                "asset_issuer": "GC7Q2WPYYUISJ2FL26UVAEDSYJG2OBIFIGZSW2NYQCMOUKPM4LI3JRJD",
                "from": "GCWEQIIHHZN2BS5Y7VPXMTMNHFL7Y5GEWJFG4QKPGRUIOP76JBVUXFWH",
                "to": "GBC4Y6VLSLAMPSRSHPRF4WQ7UVUYCG3RYUZMDZX6UUE6AHBVNCVIJ7VI",
                "amount": "100.0000000"
              }
            ]
          }
        }
      }
    ]
  },
  "options": {}
}
