{
  "caseVersion": "1",
  "id": "matched-deposit",
  "title": "Matched deposit payment",
  "description": "A completed deposit: the anchor paid 50 TRACEUSD to the user's account with the declared memo. The user's external funds are not observable.",
  "synthetic": true,
  "evidenceNote": "Recorded Horizon testnet responses for transaction 6afa8149465121037f9429c4dc006a393a748a58aefefae23d5f0bb6621c4a49 (see fixtures/testnet/manifest.json). The SEP-24 record is SYNTHETIC: no real anchor produced it.",
  "intendedOutcome": "matched",
  "records": [
    {
      "id": "syn-dep-001",
      "kind": "deposit",
      "status": "completed",
      "started_at": "2026-10-07T14:00:00Z",
      "updated_at": "2026-10-07T14:10:00Z",
      "completed_at": "2026-10-07T14:10:00Z",
      "amount_in": "52.0000000",
      "amount_out": "50.0000000",
      "amount_out_asset": "stellar:TRACEUSD:GC7Q2WPYYUISJ2FL26UVAEDSYJG2OBIFIGZSW2NYQCMOUKPM4LI3JRJD",
      "fee_details": {
        "total": "2.0000000",
        "asset": "stellar:TRACEUSD:GC7Q2WPYYUISJ2FL26UVAEDSYJG2OBIFIGZSW2NYQCMOUKPM4LI3JRJD"
      },
      "to": "GCWEQIIHHZN2BS5Y7VPXMTMNHFL7Y5GEWJFG4QKPGRUIOP76JBVUXFWH",
      "deposit_memo": "dep-2001",
      "deposit_memo_type": "text",
      "stellar_transaction_id": "6afa8149465121037f9429c4dc006a393a748a58aefefae23d5f0bb6621c4a49"
    }
  ],
  "evidence": {
    "evidenceVersion": "1",
    "capture": {
      "network": "testnet",
      "horizon": "https://horizon-testnet.stellar.org",
      "capturedAt": "2026-10-07T14:03:07.970Z",
      "note": "Raw Horizon responses recorded by scripts/testnet-fixtures.mjs; XDR blobs, signatures and _links trimmed for size."
    },
    "items": [
      {
        "transaction": {
          "hash": "6afa8149465121037f9429c4dc006a393a748a58aefefae23d5f0bb6621c4a49",
          "successful": true,
          "ledger": 5071640,
          "created_at": "2026-10-07T14:03:07Z",
          "source_account": "GBC4Y6VLSLAMPSRSHPRF4WQ7UVUYCG3RYUZMDZX6UUE6AHBVNCVIJ7VI",
          "memo_type": "text",
          "memo": "dep-2001",
          "fee_charged": "100",
          "operation_count": 1,
          "memo_bytes": "ZGVwLTIwMDE=",
          "id": "6afa8149465121037f9429c4dc006a393a748a58aefefae23d5f0bb6621c4a49",
          "fee_account": "GBC4Y6VLSLAMPSRSHPRF4WQ7UVUYCG3RYUZMDZX6UUE6AHBVNCVIJ7VI",
          "max_fee": "100"
        },
        "operations": {
          "_embedded": {
            "records": [
              {
                "id": "21782527937101825",
                "type": "payment",
                "transaction_hash": "6afa8149465121037f9429c4dc006a393a748a58aefefae23d5f0bb6621c4a49",
                "transaction_successful": true,
                "source_account": "GBC4Y6VLSLAMPSRSHPRF4WQ7UVUYCG3RYUZMDZX6UUE6AHBVNCVIJ7VI",
                "type_i": 1,
                "created_at": "2026-10-07T14:03:07Z",
                "asset_type": "credit_alphanum12",
                "asset_code": "TRACEUSD",
                "asset_issuer": "GC7Q2WPYYUISJ2FL26UVAEDSYJG2OBIFIGZSW2NYQCMOUKPM4LI3JRJD",
                "from": "GBC4Y6VLSLAMPSRSHPRF4WQ7UVUYCG3RYUZMDZX6UUE6AHBVNCVIJ7VI",
                "to": "GCWEQIIHHZN2BS5Y7VPXMTMNHFL7Y5GEWJFG4QKPGRUIOP76JBVUXFWH",
                "amount": "50.0000000"
              }
            ]
          }
        }
      }
    ]
  },
  "options": {
    "anchorAccount": "GBC4Y6VLSLAMPSRSHPRF4WQ7UVUYCG3RYUZMDZX6UUE6AHBVNCVIJ7VI"
  }
}
