{
  "caseVersion": "1",
  "id": "insufficient-missing-evidence",
  "title": "Insufficient evidence: transaction not supplied",
  "description": "The record says completed and cites a transaction id, but no evidence for that transaction was supplied. A missing transaction is never a pass.",
  "synthetic": true,
  "evidenceNote": "No evidence supplied for this case.",
  "intendedOutcome": "insufficient_evidence",
  "records": [
    {
      "id": "syn-wd-001",
      "kind": "withdrawal",
      "status": "completed",
      "started_at": "2026-10-07T13:55:00Z",
      "updated_at": "2026-10-07T14:30:00Z",
      "completed_at": "2026-10-07T14:30:00Z",
      "amount_in": "100.0000000",
      "amount_in_asset": "stellar:TRACEUSD:GC7Q2WPYYUISJ2FL26UVAEDSYJG2OBIFIGZSW2NYQCMOUKPM4LI3JRJD",
      "amount_out": "98.0000000",
      "fee_details": {
        "total": "2.0000000",
        "asset": "stellar:TRACEUSD:GC7Q2WPYYUISJ2FL26UVAEDSYJG2OBIFIGZSW2NYQCMOUKPM4LI3JRJD"
      },
      "withdraw_anchor_account": "GBC4Y6VLSLAMPSRSHPRF4WQ7UVUYCG3RYUZMDZX6UUE6AHBVNCVIJ7VI",
      "withdraw_memo": "1001",
      "withdraw_memo_type": "id",
      "from": "GCWEQIIHHZN2BS5Y7VPXMTMNHFL7Y5GEWJFG4QKPGRUIOP76JBVUXFWH",
      "stellar_transaction_id": "70e181ec6b886344c1853d078aeb7a36d1ba25431fffa058ef00fe68a1400efd"
    }
  ],
  "evidence": {
    "evidenceVersion": "1",
    "capture": {
      "network": "testnet",
      "note": "No evidence supplied for this case."
    },
    "items": []
  },
  "options": {}
}
